{
  "schema_version": "1.0",
  "name": "CBT Cards locale registry",
  "canonical": "https://cbt-cards.github.io/data/locales.json",
  "source_locale": "en",
  "updated": "2026-08-19",
  "locales": [
    {
      "locale": "en",
      "name": "English",
      "native_name": "English",
      "status": "source",
      "machine_readable": true,
      "public_html": true,
      "policy": "Website publication status only; this does not assert mobile app/store language support. Canonical source content. Published records may be used when their resource-level review status permits it."
    },
    {
      "locale": "ru",
      "name": "Russian",
      "native_name": "Русский",
      "status": "pilot",
      "machine_readable": true,
      "public_html": false,
      "policy": "Website publication status only; this does not assert mobile app/store language support. All current curated resources have machine-readable translation drafts. Drafts remain non-authoritative and produce no localized HTML until separate human language and editorial review; public HTML can be enabled later for incremental reviewed publication."
    },
    {
      "locale": "de",
      "name": "German",
      "native_name": "Deutsch",
      "status": "planned",
      "machine_readable": false,
      "public_html": false,
      "policy": "Website publication status only; this does not assert mobile app/store language support. Planned website locale. No CBT Cards German web translation should be inferred from source content until an explicit translation record exists."
    }
  ]
}
